id;language_from;language_to;word_from;word_to;type
;en;ar;"Learning English in the USA with CEL means studying at one of three California campuses run by a Student and Exchange Visitor Program (SEVP) certified school that has welcomed international students aged 16 and older for decades. CEL operates 4 locations across our school network, three of them in California: San Diego Downtown, San Diego Pacific Beach, and Santa Monica in greater Los Angeles. The program covers 9 courses across every Common European Framework of Reference (CEFR) level from A1 to C2, hosts more than 1,000 students per year from over 23 nationalities, and offers 19 housing options across the two USA cities. Small class sizes average 7 students per group, new courses start every Monday, and certified instructors prepare students for university entry, professional careers, and the cultural immersion of living in California.";"تعني دراسة اللغة الإنجليزية في الولايات المتحدة مع CEL الدراسة في واحد من 3 فروع في كاليفورنيا تديرها مدرسة معتمدة من برنامج تبادل الطلاب والزوار (SEVP) والتي استقبلت الطلاب الدوليين من عمر 16 عاماً فأكثر لعقود. تدير CEL شبكة تتكون من 4 مواقع مدرسية، 3 منها في كاليفورنيا: San Diego Downtown، و San Diego Pacific Beach، و Santa Monica في منطقة Los Angeles الكبرى. يغطي البرنامج 9 دورات عبر كل مستويات الإطار الأوروبي المرجعي المشترك للغات (CEFR) من A1 إلى C2، ويستضيف أكثر من 1000 طالب سنوياً من أكثر من 23 جنسية، ويقدم 19 خياراً للسكن في المدينتين الأمريكيتين. يبلغ متوسط حجم الفصول الصغيرة 7 طلاب في كل مجموعة، وتبدأ دورات جديدة كل يوم اثنين، ويقوم المعلمون المعتمدون بإعداد الطلاب لدخول الجامعة، والمسيرات المهنية، والانغماس الثقافي للعيش في كاليفورنيا.";Text
;en;ar;"Who is the superior Pacific Beach apartment for?";"لمن تناسب شقق باسيفيك بيتش الفاخرة؟";Text
;en;ar;"California Coastal Learning";"التعلم على ساحل كاليفورنيا";Text
;en;ar;"Immersive Language Learning";"تعلم اللغة الانغماسي";Text
;en;ar;"Mastering the test requires more than just general language skills. The english plus toefl preparation syllabus breaks down the examination into four core areas: reading, listening, speaking, and writing. The reading sections focus on university-level texts. You learn how to skim passages quickly to find specific information without reading every single word. Pacing is critical. Our instructors teach you how to pace your reading and structure essays within strict time limits. The listening modules simulate real university lectures. You practice taking shorthand notes while processing complex academic concepts.";"يتطلب إتقان الاختبار أكثر من مجرد مهارات لغوية عامة. يقسم منهج الإنجليزية زائد التحضير لاختبار TOEFL الاختبار إلى أربعة مجالات أساسية: القراءة، الاستماع، التحدث، والكتابة. تركز أقسام القراءة على نصوص بمستوى جامعي. تتعلم كيفية قراءة الفقرات بسرعة للعثور على معلومات محددة دون قراءة كل كلمة بمفردها. السرعة حاسمة. يعلمك مدرسونا كيفية ضبط سرعة قراءتك وهيكلة المقالات ضمن حدود زمنية صارمة. تحاكي وحدات الاستماع محاضرات جامعية حقيقية. تتدرب على تدوين الملاحظات السريعة أثناء معالجة مفاهيم أكاديمية معقدة.";Text
;en;ar;"Exam certification track";"مسار شهادات الامتحانات";Text
;en;ar;"What is the typical progress timeline for private lessons?";"ما هو الجدول الزمني المعتاد للتقدم في الدروس الخاصة؟";Text
;en;ar;"To truly benefit from this setup, you need to engage with your flatmates. Leave your bedroom door open when you are relaxing. Propose group dinners where everyone cooks a dish from their home country. The students who get the most out of their San Diego English journey are the ones who treat their housing as an extension of the classroom. The shared environment provides a safety net for making mistakes without judgment. Your flatmates are also learning, so they understand the struggle of finding the right word.";"للاستفادة حقاً من هذا النظام، يجب أن تتفاعل مع زملائك في الشقة. اترك باب غرفة نومك مفتوحاً عندما تسترخي. اقترح عشاءً جماعياً يطبخ فيه كل شخص طبقاً من بلده. الطلاب الذين يحققون أقصى استفادة من رحلة اللغة الإنجليزية في San Diego هم أولئك الذين يعتبرون سكنهم امتداداً للفصل الدراسي. توفر البيئة المشتركة شبكة أمان لارتكاب الأخطاء دون أحكام. يتعلم زملاؤك في السكن أيضاً، لذا فهم يتفهمون صعوبة العثور على الكلمة المناسبة.";Text
;en;ar;"How does it compare to specialized programs?";"كيف تقارن بالبرامج المتخصصة؟";Text
;en;ar;"Understanding our english plus toefl preparation course";"فهم دورة الإنجليزية بلس التحضير لاختبار التوفل";Text
;en;ar;"What is included in your room?";"ماذا تتضمن غرفتك؟";Text
;en;ar;"Vancouver Host Families";"عائلات الإقامة المضيفة في فانكوفر";Text
;en;ar;"CEL, the College of English Language, is an accredited English language school where international students aged 16 and older study across three campuses in North America: two in California (San Diego, and Santa Monica/Los Angeles) and one in downtown Vancouver, British Columbia. Class sizes average seven students per group (maximum twelve), the school holds a 4.8-star rating from more than 195 student reviews, and start dates open every Monday throughout the year. Programs run from one-week intensives through multi-month progressions toward advanced English fluency, and admissions support is available in nine languages including English, Spanish, German, French, Italian, Portuguese, Korean, Japanese, and Arabic.";"تعتبر CEL، أو College of English Language، مدرسة لغة إنجليزية معتمدة حيث يدرس الطلاب الدوليون من سن 16 عاماً فما فوق عبر ثلاثة أحرم جامعية في أمريكا الشمالية: اثنان في كاليفورنيا (San Diego، وSanta Monica/Los Angeles) وواحد في وسط مدينة Vancouver في بريتش كولومبيا. يبلغ متوسط عدد الطلاب 7 في كل مجموعة (بحد أقصى 12 طالباً)، وتحمل المدرسة تصنيف 4.8 نجوم من أكثر من 195 تقييماً طلابياً، وتبدأ فصول جديدة كل يوم اثنين طوال العام. تتراوح البرامج من دورات مكثفة لمدة أسبوع واحد إلى برامج تمتد لعدة أشهر للوصول إلى الطلاقة المتقدمة في اللغة الإنجليزية، ويتوفر دعم القبول بتسع لغات تشمل الإنجليزية، الإسبانية، الألمانية، الفرنسية، الإيطالية، البرتغالية، الكورية، اليابانية، والعربية.";Text
;en;ar;"The 4-week minimum duration gives you enough time to establish a stable routine. Short-term visitors sometimes feel rushed. A full month lets you settle in properly. You figure out the fastest 16-minute walking route to the College of English Language campus. You find your preferred grocery store. You learn the layout of the kitchen and claim a shelf in the fridge. Students planning a longer semester abroad often book the shared apartment silverstone to anchor their initial arrival in the country. Once the first 4 weeks end, you might extend your stay or explore other neighborhoods. Managing an apartment requires responsibility. You buy your own ingredients. You clean up after yourself. This independence appeals strongly to adult learners.";"تمنحك فترة الأربعة أسابيع كحد أدنى وقتاً كافياً لإنشاء روتين مستقر. يشعر الزوار لفترات قصيرة أحياناً بالاستعجال. يسمح لك قضاء شهر كامل بالاستقرار بشكل صحيح. تكتشف أسرع مسار للمشي لمدة 16 دقيقة إلى حرم College of English Language. تجد متجر البقالة المفضل لديك. تتعرف على تخطيط المطبخ وتخصص لنفسك رَفاً في الثلاجة. يحجز الطلاب الذين يخططون لقضاء فصل دراسي طويل في الخارج غالباً شقة silverstone المشتركة لتثبيت أقدامهم عند الوصول إلى البلاد. بمجرد انتهاء الأسابيع الأربعة الأولى، قد تمدد إقامتك أو تستكشف أحياء أخرى. تتطلب إدارة الشقة تحمّل المسؤولية. تشتري مكوناتك بنفسك. تنظف مكانك. تروق هذه الاستقلالية كثيراً للمتعلمين البالغين.";Text
;en;ar;"Making the most of your international living experience";"تحقيق أقصى استفادة من تجربة العيش الدولية";Text
;en;ar;"CEL Los Angeles is the College of English Language's accredited California campus on Wilshire Boulevard in Santa Monica, two blocks from the Pacific Ocean. It runs small classes year-round for international students who want to learn English in the United States with daily speaking practice, set in a city where international industries make English fluency directly tied to professional opportunity. The school is part of CEL's three-campus network across Santa Monica, San Diego, and Vancouver, Canada, so course progress and accommodation can transfer between locations during a longer stay.";"يمثل CEL Los Angeles الحرم الجامعي المعتمد لمؤسسة College of English Language في كاليفورنيا، ويقع على شارع ويلشاير في سانتا مونيكا على بُعد مبنيين من المحيط الهادئ. يدير المركز فصولاً صغيرة على مدار العام للطلاب الدوليين الراغبين في تعلم اللغة الإنجليزية في الولايات المتحدة مع ممارسة التحدث يومياً، ويقع في مدينة تجعل فيها الصناعات الدولية طلاقة اللغة الإنجليزية مرتبطة ارتباطاً مباشراً بالفرص المهنية. تعد المدرسة جزءاً من شبكة CEL المكونة من ثلاثة أحرم جامعية تمتد عبر سانتا مونيكا، وSan Diego، وVancouver في كندا، مما يسمح بنقل التقدم الدراسي ومحل الإقامة بين هذه المواقع خلال فترات الإقامة الطويلة.";Text
;en;ar;"Staying in a student house is an excellent stepping stone for long-term plans. Students aiming to enter a pathway program often choose this option. It simulates the independence you will need at a Canadian university. You learn to balance domestic chores with heavy study loads. It takes discipline. You must wash your clothes, clean your room, and finish your essays on time. This maturity is exactly what higher education demands. If you plan to transfer to a local college, living here first prepares you for the realities of a university student house. You build a strong foundation of life skills alongside your language development. You leave the program as a more capable, self-reliant adult.";"يعد البقاء في سكن الطلاب نقطة انطلاق ممتازة لخططك طويلة المدى. غالباً ما يختار الطلاب الذين يهدفون إلى الالتحاق ببرنامج المسار الجامعي هذا الخيار. إنه يحاكي الاستقلالية التي ستحتاجها في الجامعات الكندية. تتعلم كيفية الموازنة بين الأعمال المنزلية والأعباء الدراسية الثقيلة. يتطلب الأمر الانضباط. يجب عليك غسل ملابسك، وتنظيف غرفتك، وإنهاء مقالاتك في الوقت المحدد. هذا النضج هو بالضبط ما يتطلبه التعليم العالي. إذا كنت تخطط للانتقال إلى كلية محلية، فإن العيش هنا أولاً يجهزك لواقع سكن الطلاب الجامعي. أنت تبني أساساً قوياً من المهارات الحياتية جنباً إلى جنب مع تطورك اللغوي. لتغادر البرنامج كشخص بالغ أكثر كفاءة واعتماداً على الذات.";Text
;en;ar;"Transitioning to independent living";"الانتقال إلى العيش المستقل";Text
;en;ar;"Premium Coastal Living";"معيشة ساحلية فاخرة";Text
;en;ar;"Studying English inside the United States is more than vocabulary practice. It builds the academic register, classroom discussion habits, and writing conventions American universities expect from day one, and it puts students inside the country for months of cultural and academic acclimatisation before degree coursework begins. For applicants targeting institutions that ask for a TOEFL or International English Language Testing System (IELTS) score, CEL's TOEFL-focused English program layers exam strategy onto everyday language study so the move from preparation to test day feels routine rather than abrupt.";"دراسة اللغة الإنجليزية داخل الولايات المتحدة تعني أكثر من مجرد ممارسة المفردات. فهي تبني الأسلوب الأكاديمي، وعادات النقاش في الفصول الدراسية، وقواعد الكتابة التي تتوقعها الجامعات الأمريكية منذ اليوم الأول، كما تضع الطلاب داخل البلاد لأشهر من التأقلم الثقافي والأكاديمي قبل بدء دراسة التخصص. بالنسبة للمتقدمين الذين يستهدفون المؤسسات التي تطلب درجات اختبار التوفل (TOEFL) أو اختبار الآيلتس (IELTS)، يدمج برنامج اللغة الإنجليزية للتحضير لاختبار التوفل في CEL استراتيجية الامتحان مع دراسة اللغة اليومية، لتصبح خطوة الانتقال من التحضير إلى يوم الاختبار أمراً روتينياً غير مفاجئ.";Text
;en;ar;"Breaking through the intermediate plateau";"تخطي مرحلة الثبات المتوسطة";Text
;en;ar;"Commuting from your homestay neighborhood";"التنقل من حي الإقامة المضيفة";Text
;en;ar;"American homestay dinners usually happen earlier in the evening than in many European or South American countries. Meals vary depending on the family background. San Diego is incredibly diverse. Your hosts might cook traditional American dishes, Mexican-inspired meals, or Asian cuisine depending on their heritage. You eat what they eat. This culinary variety reflects the reality of Southern California living. Students planning to learn English in the USA should arrive with an open mind regarding food and daily schedules. Families are busy. Parents work. Children attend school. You are expected to clean up after yourself and keep your room tidy. It is not a hotel service. It is a shared living experience.";"تتناول العائلات الأمريكية وجبة العشاء عادةً في وقت مبكر من المساء مقارنة بالعديد من الدول الأوروبية أو دول أمريكا الجنوبية. تختلف الوجبات باختلاف الخلفية الثقافية للعائلة. تتميز San Diego بتنوع مذهل. قد يطبخ مضيفوك أطباقاً أمريكية تقليدية، أو وجبات مستوحاة من المطبخ المكسيكي، أو مأكولات آسيوية بناءً على أصولهم. تأكل مما يأكلون منه. يعكس هذا التنوع في الطهي واقع الحياة في جنوب كاليفورنيا. يجب على الطلاب الذين يخططون إلى دراسة اللغة الإنجليزية في أمريكا القدوم بعقل منفتح تجاه الطعام والجداول اليومية. العائلات مشغولة. الآباء يعملون. والأطفال يذهبون إلى المدارس. يُتوقع منك أن تنظف مكانك وترتب غرفتك. هي ليست خدمة فندقية. إنها تجربة معيشة مشتركة.";Text
;en;ar;"Study In America";"الدراسة في أمريكا";Text
;en;ar;"Cultural exchange and mealtime habits";"التبادل الثقافي وعادات أوقات الوجبات";Text
;en;ar;"What is the daily commute like?";"كيف تبدو رحلة التنقل اليومية؟";Text
;en;ar;"How does the city compare to other english language school destinations?";"كيف تقارن المدينة بوجهات مدرسة لغة إنجليزية أخرى؟";Text
;en;ar;"The final weeks of the global pathway center on output. You compile a portfolio of your written work. You record yourself delivering a 15-minute presentation complete with visual aids. Our academic coordinators review this portfolio to ensure you meet the rigorous standards of our partner institutions. Transitioning into the North American higher education system feels overwhelming at first. You face new grading rubrics and unfamiliar classroom etiquette. This program eliminates that shock. You walk into your first university seminar knowing exactly how to participate, take notes, and succeed. For students interested in a shorter academic experience, exploring our semester abroad options might be a better fit.";"تتركز الأسابيع الأخيرة على المخرجات. تقوم بتجميع ملف لأعمالك المكتوبة. وتسجل لنفسك عرضاً تقديمياً مدته 15 دقيقة مع وسائل إيضاح بصرية. يراجع منسقونا الأكاديميون هذا الملف لضمان استيفائك للمعايير الصارمة لمؤسساتنا الشريكة. يبدو الانتقال إلى نظام التعليم العالي في أمريكا الشمالية مربكاً في البداية. تواجه معايير تقييم جديدة وآداب سلوك غير مألوفة في الفصول الدراسية. يزيل هذا البرنامج تلك الصدمة. تدخل إلى ندوتك الجامعية الأولى وأنت تعرف تماماً كيف تشارك، وتدون الملاحظات، وتنجح. بالنسبة للطلاب المهتمين بتجربة أكاديمية أقصر، قد يكون الاطلاع على خيارات الفصل الدراسي بالخارج هو الأنسب.";Text
;en;ar;"The camp pairs English instruction with structured cultural immersion. Students choose between General English at any level for a standard skills-focused course and Future Global Leaders, a project-based programme covering business and cross-cultural communication that runs in 3-week sessions and requires a minimum Common European Framework of Reference Level B2. Classes follow CEL's small-class teaching model, averaging 7 students per class with a maximum of 12, and the school's location places students within walking distance of Pacific Beach. The fee covers tuition, host-family accommodation, and the included excursion programme, so families budget for one combined trip rather than a list of separate add-ons.";"يجمع المخيم بين تعليم اللغة الإنجليزية والانغماس الثقافي المنظم. يختار الطلاب بين دورة إنجليزية عامة في أي مستوى للتركيز على المهارات الأساسية، أو برنامج قادة المستقبل العالميين، وهو برنامج قائم على المشاريع يغطي الأعمال والتواصل عبر الثقافات، ويستمر لمدة 3 أسابيع ويتطلب حداً أدنى من المستوى B2 وفقاً للإطار الأوروبي المرجعي العام للغات (CEFR). تتبع الفصول نموذج التدريس في المجموعات الصغيرة الخاص بمعهد CEL، بمتوسط 7 طلاب لكل فصل وبحد أقصى 12 طالباً، ويضع موقع المدرسة الطلاب على مسافة قريبة سيراً على الأقدام من باسيفيك بيتش. تشمل الرسوم التكاليف الدراسية، الإقامة لدى عائلة مضيفة، وبرنامج الرحلات، ما يسمح للعائلات بتخصيص ميزانية لرحلة واحدة مجمعة بدلاً من خدمات منفصلة.";Text
;en;ar;"If you are calculating the cost of studying English in Canada, a homestay package often presents the most predictable budget. Private bathrooms are available at a surcharge of $100 per week. Availability for private bathrooms is strictly limited. Most students share a bathroom with the family or other hosted students. This requires respect for basic house rules and daily schedules.";"إذا كنت تحسب تكلفة دراسة اللغة الإنجليزية في كندا، فإن باقة الإقامة مع عائلة غالباً ما تقدم الميزانية الأكثر قابلية للتنبؤ. تتوفر الحمامات الخاصة مقابل رسوم إضافية تبلغ 100 دولار في الأسبوع. توفر الحمامات الخاصة محدود للغاية. يشترك معظم الطلاب في الحمام مع العائلة أو مع طلاب آخرين مستضافين. هذا يتطلب احترام قواعد المنزل الأساسية والجداول اليومية.";Text
;en;ar;"How does a pathway program prepare you for US universities?";"كيف يجهزك برنامج المسار الجامعي للجامعات الأمريكية؟";Text
;en;ar;"This specific apartment economy apt living fits older students who already have experience living on their own. The minimum age requirement of 19 years ensures a mature environment throughout the building. You do not have to negotiate shared living room rules or wait for a communal shower. Having a private bathroom and personal cooking area eliminates common roommate conflicts. Students heavily rely on quiet evenings to study. They need predictability. You control the noise level. You control the lighting. You control when you eat. If you plan to enter higher education later, this setup mirrors university dorm living. You practice self-discipline. No host family will tell you when dinner is ready or remind you to do your homework. That level of responsibility prepares you for the realities of academic life. Reading about living in Vancouver as a student helps set expectations for this level of independence.";"تناسب هذه الشقة الاقتصادية تحديداً الطلاب الأكبر سناً ممن لديهم بالفعل تجربة في العيش بمفردهم. يضمن الحد الأدنى للعمر البالغ 19 عاماً بيئة ناضجة في جميع أنحاء المبنى. لست مضطراً للتفاوض على قواعد غرفة المعيشة المشتركة أو انتظار دورك للاستحمام. وجود حمام خاص ومنطقة طهي شخصية يقضي على النزاعات الشائعة مع شركاء السكن. يعتمد الطلاب بشكل كبير على الأمسيات الهادئة للدراسة. يحتاجون إلى الاستقرار. أنت تتحكم في مستوى الضوضاء. وتتحكم في الإضاءة. وتتحكم في موعد تناول طعامك. إذا كنت تخطط للالتحاق بالتعليم العالي لاحقاً، فهذا النظام يحاكي العيش في السكن الجامعي. أنت تمارس الانضباط الذاتي. لن تخبرك أي عائلة مضيفة بأن العشاء جاهز، أو تذكرك بأداء واجباتك المدرسية. هذا المستوى من المسؤولية يهيئك لواقع الحياة الأكاديمية. تساعد القراءة عن تجربة العيش في Vancouver كطالب في تحديد التوقعات لهذا المستوى من الاستقلالية.";Text
;en;ar;"Self-catering and kitchen amenities";"الخدمة الذاتية ومرافق المطبخ";Text
