id;language_from;language_to;word_from;word_to;type
;en;ar;"Some students confuse english academic skills with test preparation. A TOEFL exam preparation class teaches you how to pass a specific exam. It focuses on timing, multiple-choice strategies, and scoring rubrics. Once you pass that test, you still need to know how to survive your first semester. That is where this specific curriculum takes over. It teaches you how to study and process large volumes of information. Those looking to enter the corporate world might prefer the English for Career Development option instead. That syllabus swaps essay writing for business correspondence, resume building, and interview practice.";"يخلط بعض الطلاب بين المهارات الأكاديمية الإنجليزية والتحضير للاختبارات. يعلمك فصل التحضير لاختبار التوفل (TOEFL) كيفية اجتياز اختبار معين. ويركز على تنظيم الوقت، واستراتيجيات الاختيار من متعدد، ومعايير التقييم. بمجرد اجتيازك لذلك الاختبار، ستظل بحاجة إلى معرفة كيفية تخطي فصلك الدراسي الأول بنجاح. هنا يأتي دور هذا المنهج بالتحديد. فهو يعلمك كيفية دراسة ومعالجة كميات كبيرة من المعلومات. قد يفضل الساعون لدخول عالم الشركات خيار الإنجليزية للتطوير المهني بدلاً من ذلك. يستبدل ذلك المنهج كتابة المقالات بالمراسلات التجارية، وبناء السير الذاتية، والتدريب على المقابلات الشخصية.";Text
;en;ar;"What are the rules for common areas?";"ما هي القواعد الخاصة بالمناطق المشتركة؟";Text
;en;ar;"Student Accommodation";"سكن الطلاب";Text
;en;ar;"Comparing outcomes and study paths";"مقارنة النتائج ومسارات الدراسة";Text
;en;ar;"How does the downtown location impact daily life?";"كيف يؤثر موقع وسط المدينة على الحياة اليومية؟";Text
;en;ar;"Santa Monica is a coastal Los Angeles neighborhood with the Third Street Promenade, the Pier, the bike path along the beach, and easy connection by Metro into Hollywood, Downtown LA, and Culver City. CEL Los Angeles sits inside this neighborhood, which means students walk to class in the morning and meet classmates over coffee or at the beach in the afternoon. Class sizes stay deliberately small so that every student speaks during every lesson, and teachers know each student's name and progress level from the first week.";"تعتبر سانتا مونيكا حياً ساحلياً في Los Angeles يضم ممشى الشارع الثالث، والرصيف البحري، ومسار الدراجات الممتد على طول الشاطئ، مع سهولة التنقل عبر المترو إلى هوليوود ووسط مدينة Los Angeles وكولفر سيتي. يقع فرع CEL Los Angeles داخل هذا الحي، مما يعني أن الطلاب يمشون إلى فصولهم الدراسية في الصباح ويلتقون بزملائهم لتناول القهوة أو الجلوس على الشاطئ في فترة ما بعد الظهيرة. تظل أحجام الفصول صغيرة عمداً لضمان تحدث كل طالب خلال كل درس، ويعرف المعلمون اسم كل طالب ومستوى تقدمه منذ الأسبوع الأول.";Text
;en;ar;"The freedom of self-catering means you dictate your own schedule. If you are an early riser, you can enjoy a quiet breakfast before the rest of the apartment wakes up. Night owls might prefer late dinners while planning the next day's excursions. Accommodating different lifestyles teaches compromise and cultural tolerance. The apartment property is managed directly by CEL. That means any maintenance issues or housing questions go directly through the school staff. You do not have to deal with a third-party landlord. This direct management provides peace of mind. If a lightbulb burns out or a sink drips, you simply notify the housing coordinator at the campus. Fast resolutions. Less stress.";"تعني حرية الخدمة الذاتية أنك تحدد جدولك الزمني الخاص. إذا كنت تستيقظ مبكراً، يمكنك الاستمتاع بوجبة إفطار هادئة قبل أن يستيقظ باقي سكان الشقة. قد يفضل من يسهرون ليلاً تناول العشاء في وقت متأخر أثناء التخطيط لرحلات اليوم التالي. يُعلم استيعاب أنماط الحياة المختلفة التسامح الثقافي والوصول إلى حلول وسط. يُدار عقار الشقق مباشرة من قبل CEL. يعني ذلك أن أي مشكلات متعلقة بالصيانة أو أسئلة حول السكن تُوجه مباشرة إلى موظفي المدرسة. لست مضطراً للتعامل مع مالك عقار خارجي. توفر هذه الإدارة المباشرة راحة البال. إذا احترق مصباح أو حدث تسرب في الحوض، فما عليك سوى إبلاغ منسق السكن في الحرم الجامعي. حلول سريعة. ضغط أقل.";Text
;en;ar;"Achieving a high score in the English Plus Cambridge Prep requires living the language outside of classroom hours. Your brain needs continuous exposure to native speech patterns to internalize complex grammar. We strongly recommend choosing an immersive living arrangement during your exam preparation period. Staying with a local host family forces you to practice everyday conversation. Exploring our student housing options gives you a clear picture of how you can structure your life around your studies.";"يتطلب تحقيق درجة عالية في دورة التحضير English Plus Cambridge Prep ممارسة اللغة خارج ساعات الفصل الدراسي. يحتاج عقلك إلى تعرض مستمر لأنماط الكلام الأصلية لاستيعاب القواعد المعقدة. نوصي بشدة باختيار ترتيب معيشي اندماجي خلال فترة التحضير للامتحان. تجبرك الإقامة لدى عائلة محلية مضيفة على ممارسة المحادثات اليومية. يمنحك الاطلاع على خيارات سكن الطلاب صورة واضحة حول كيفية تنظيم حياتك بالتوازي مع دراستك.";Text
;en;ar;"We recommend booking your study plan several months in advance. Securing the right visa and housing takes time. F-1 student visa applicants need to complete their I-20 form processing well before the start date. Contact our admissions team early to map out your timeline. With the right foundation, dedicated study habits, and expert instruction, the english plus toefl preparation course gives you the competitive edge required for university acceptance.";"نوصي بحجز خطتك الدراسية قبل عدة أشهر. تأمين التأشيرة المناسبة والسكن يستغرق وقتاً. يحتاج المتقدمون للحصول على فيزا F-1 إلى إكمال معالجة نموذج I-20 الخاص بهم قبل تاريخ البدء بوقت كافٍ. تواصل مع فريق القبول لدينا مبكراً لرسم جدولك الزمني. من خلال الأساس الصحيح، وعادات الدراسة الملتزمة، والتعليم المتخصص، تمنحك دورة الإنجليزية بلس التحضير لاختبار التوفل الميزة التنافسية المطلوبة للقبول الجامعي.";Text
;en;ar;"Academic Study Abroad";"الدراسة الأكاديمية في الخارج";Text
;en;ar;"Which location provides the right professional exposure?";"أي موقع يوفر التعرض المهني المناسب؟";Text
;en;ar;"Daily life and cultural integration";"الحياة اليومية والاندماج الثقافي";Text
;en;ar;"Cooking at home to stretch your budget";"الطهي في المنزل لتوفير ميزانيتك";Text
;en;ar;"Reaching the downtown campus from your student house takes roughly 25 minutes by public transportation. It mirrors the routine of local professionals. You will likely rely on TransLink, the regional transportation network in British Columbia. Monthly transit passes offer unlimited travel across the bus and SkyTrain network. Buying a compass card is usually your first task upon arrival. During that morning ride, many students listen to local podcasts or review their notes. It sets a productive tone for the day. If you want to maximize your time, you must embrace these small daily routines. The transit system connects you easily to neighborhoods beyond the downtown core. Weekend excursions become simple. You might travel to local markets or meet friends for coffee in different districts. Understanding the Vancouver transit map is a vital survival skill. It gives you true independence when navigating back to your student house.";"يستغرق الوصول إلى الحرم الجامعي في وسط المدينة من سكن الطلاب حوالي 25 دقيقة باستخدام وسائل النقل العام. هذا يعكس الروتين اليومي للموظفين المحليين. ستعتمد على الأرجح على TransLink، وهي شبكة النقل الإقليمية في بريتش كولومبيا. توفر بطاقات النقل الشهرية سفراً غير محدود عبر شبكة الحافلات والقطار المعلق (SkyTrain). يعد شراء بطاقة Compass عادة مهمتك الأولى عند الوصول. خلال تلك الرحلة الصباحية، يستمع العديد من الطلاب إلى قنوات البودكاست المحلية أو يراجعون ملاحظاتهم. هذا يضع طابعاً إنتاجياً لليوم. إذا كنت ترغب في تحقيق أقصى استفادة من وقتك، يجب عليك الالتزام بهذه الروتينيات اليومية الصغيرة. يربطك نظام النقل بسهولة بالأحياء الواقعة خارج قلب وسط المدينة. تصبح الرحلات في عطلة نهاية الأسبوع بسيطة. قد تسافر إلى الأسواق المحلية أو تلتقي بالأصدقاء لتناول القهوة في مناطق مختلفة. يعد فهم خريطة النقل في Vancouver مهارة حيوية للعيش. إنه يمنحك استقلالية حقيقية عند العودة إلى سكن الطلاب الخاص بك.";Text
;en;ar;"Campus availability and student life";"توافر الحرم الجامعي والحياة الطلابية";Text
;en;ar;"Comparing your exam preparation choices";"مقارنة خيارات التحضير لاختباراتك";Text
;en;ar;"Preparing for professional and academic success";"التحضير للنجاح المهني والأكاديمي";Text
;en;ar;"Starting at a new english language school can feel intimidating at first. Do not worry. Every Monday, fresh classes begin with a clear orientation. You take a placement test to determine your exact baseline. This ensures you sit next to peers at the same proficiency stage. The curriculum moves quickly. Within 48 hours, you will join your assigned group and start participating in conversation-driven lessons. You immediately practice structures you can use outside the building. The neighborhood around Coal Harbour provides the perfect testing ground. You will buy lunch at Granville Island or grab coffee in Gastown. These daily interactions solidify what you review in the classroom. Need extra help? Teachers monitor your weekly assessments to catch any struggles early. They know your name. They know your goals.";"قد يبدو البدء في مدرسة لغة إنجليزية جديدة أمراً مخيفاً في البداية. لا تقلق. تبدأ فصول جديدة كل يوم اثنين بتوجيه واضح. تخضع لاختبار تحديد المستوى لمعرفة مستواك الأساسي بدقة. يضمن هذا جلوسك بجوار زملاء في نفس مرحلة الكفاءة. يتقدم المنهج بسرعة. ستنضم خلال 48 ساعة إلى مجموعتك المخصصة وتبدأ في المشاركة في دروس تعتمد على المحادثة. تمارس على الفور التراكيب التي يمكنك استخدامها خارج المبنى. يوفر الحي المحيط بمنطقة كول هاربور ساحة اختبار مثالية. ستشتري الغداء في جزيرة جرانفيل أو تتناول القهوة في غاستاون. ترسخ هذه التفاعلات اليومية ما تراجعه في الفصل. هل تحتاج إلى مساعدة إضافية؟ يراقب المعلمون تقييماتك الأسبوعية لاكتشاف أي صعوبات مبكراً. إنهم يعرفون اسمك. إنهم يعرفون أهدافك.";Text
;en;ar;"Building routines outside the classroom";"بناء روتين خارج الفصل الدراسي";Text
;en;ar;"Most educators consider a 12-week stay the minimum duration for a complete language overhaul. This length allows you to fully integrate into a stable learning routine. A three-month commitment provides the deep immersion necessary to shift your brain into thinking in a new language. You advance at least one full level. This duration offers a strong return on your educational investment. Longer stays also reduce your weekly tuition costs. If you are applying for a Canadian study permit, you may also need a Guaranteed Investment Certificate (GIC) to prove your financial support. If you need help calculating your budget, check our tuition breakdown to plan your finances effectively. Many students pursuing English in Vancouver use this 12-week block as a springboard for further academic pursuits.";"يعتبر معظم المعلمين الإقامة لمدة 12 أسبوعاً الحد الأدنى لإحداث تغيير جذري في مستوى اللغة. تتيح لك هذه المدة الاندماج بالكامل في روتين تعليمي مستقر. يوفر الالتزام لمدة ثلاثة أشهر الانغماس العميق اللازم لتحويل عقلك نحو التفكير بلغة جديدة. تتقدم بمقدار مستوى كامل على الأقل. تقدم هذه المدة عائداً قوياً على استثمارك التعليمي. تقلل الإقامات الأطول أيضاً من تكاليف الرسوم الدراسية الأسبوعية. إذا كنت تتقدم للحصول على تصريح الدراسة الكندي، قد تحتاج أيضاً إلى Guaranteed Investment Certificate (GIC) لإثبات دعمك المالي. إذا كنت بحاجة إلى مساعدة في حساب ميزانيتك، تحقق من تفاصيل الرسوم الدراسية لتخطيط شؤونك المالية بفعالية. يستخدم العديد من الطلاب الذين يدرسون الإنجليزية في Vancouver هذه الفترة المكونة من 12 أسبوعاً كنقطة انطلاق لمساعي أكاديمية مستقبلية.";Text
;en;ar;"Transitioning to academic or career goals";"الانتقال إلى الأهداف الأكاديمية أو المهنية";Text
;en;ar;"Preparing for your initial stay";"التحضير لإقامتك الأولى";Text
;en;ar;"Where you sleep influences how fast you learn. Securing an immersive living situation forces you to communicate naturally during breakfast and dinner. Students who live with local hosts report higher confidence in casual settings. Practicing idioms and slang over a shared meal builds a type of fluency that textbooks cannot replicate. Securing comfortable CEL student housing is just as critical as selecting the right course intensity. You can also compare the overall experience of learning in Canada versus studying at our San Diego language school or taking Los Angeles English courses in California. Every location offers a distinct cultural backdrop for your language development. Commission on English Language Program Accreditation (CEA) standards govern our US schools, ensuring quality matches what you experience in Canada.";"يؤثر المكان الذي تنام فيه على سرعة تعلمك. يجبرك تأمين بيئة سكنية تفاعلية على التواصل بشكل طبيعي أثناء الإفطار والعشاء. يبلغ الطلاب الذين يقيمون مع عائلات مضيفة محلية عن ثقة أعلى في المواقف غير الرسمية. تبني ممارسة التعابير الاصطلاحية والعامية خلال وجبة مشتركة نوعاً من الطلاقة لا يمكن للكتب المدرسية تكراره. يعد تأمين سكن طلاب CEL المريح أمراً بالغ الأهمية تماماً مثل اختيار كثافة الدورة المناسبة. يمكنك أيضاً مقارنة التجربة الكلية للتعلم في كندا مقابل الدراسة في مدرسة لغة في San Diego التابعة لنا أو أخذ دورة لغة إنجليزية في Los Angeles في كاليفورنيا. يقدم كل موقع خلفية ثقافية مميزة لتطورك اللغوي. تحكم معايير Commission on English Language Program Accreditation (CEA) مدارسنا في الولايات المتحدة، مما يضمن تطابق الجودة مع ما تختبره في كندا.";Text
;en;ar;"Building your academic portfolio";"بناء ملفك الأكاديمي";Text
;en;ar;"Accommodation and out-of-class immersion";"السكن والانغماس خارج الفصل";Text
;en;ar;"The program brings together intensive English instruction with the rhythms of a U.S. college calendar, including coursework, campus activities, and a student community built across nationalities. CEL's San Diego campus is accredited by CEA (Commission on English Language Program Accreditation) and certified by SEVIS (Student and Exchange Visitor Information System), which means CEL can issue the Form I-20 students need for an F-1 Student Visa. The result is that students handle the academic, legal, and social aspects of a U.S. semester in one place rather than navigating multiple institutions.";"يجمع البرنامج بين تدريس اللغة الإنجليزية المكثف وإيقاعات التقويم الجامعي الأمريكي، ويشمل ذلك المقررات الدراسية والأنشطة داخل الحرم الجامعي ومجتمعاً طلابياً يضم جنسيات متعددة. يحظى فرع CEL في San Diego باعتماد CEA (Commission on English Language Program Accreditation) وشهادة SEVIS (Student and Exchange Visitor Information System)، ما يعني أن CEL قادرة على إصدار نموذج I-20 الذي يحتاجه الطلاب للحصول على فيزا F-1. النتيجة هي أن الطلاب يديرون الجوانب الأكاديمية والقانونية والاجتماعية للفصل الدراسي في الولايات المتحدة في مكان واحد بدلاً من تشتت التعامل مع مؤسسات متعددة.";Text
;en;ar;"How does this space support academic focus?";"كيف تدعم هذه المساحة التركيز الأكاديمي؟";Text
;en;ar;"Academic University Transition";"الانتقال الأكاديمي للجامعة";Text
;en;ar;"Daily routine and coastal geography";"الروتين اليومي والجغرافيا الساحلية";Text
;en;ar;"The structure runs across two semesters of focused study designed to build both academic English and the practical skills that employers and admissions teams value. CEL is certified by the Student and Exchange Visitor Information System (SEVIS) and accredited by the Commission on English Language Program Accreditation (CEA), which means the school can issue the Form I-20 students need to apply for an F-1 Student Visa. Each program connects to one of CEL's 150+ partner colleges and universities in North America, and admissions advisors help match students to the institutions that suit their goals, budget, and academic profile.";"تمتد الهيكلة عبر فصلين دراسيين من الدراسة المركزة المصممة لبناء كل من الإنجليزية الأكاديمية والمهارات العملية التي يقدرها أصحاب العمل وفرق القبول. معهد CEL معتمد من نظام معلومات الطلاب والزائرين ببرامج التبادل (SEVIS) ومعتمد من لجنة اعتماد برامج اللغة الإنجليزية (CEA)، مما يعني قدرة المدرسة على إصدار نموذج Form I-20 الذي يحتاجه الطلاب للتقديم على فيزا F-1 للطلاب. يرتبط كل برنامج بواحدة من أكثر من 150 كلية وجامعة شريكة لمعهد CEL في أمريكا الشمالية، ويساعد مستشارو القبول في اختيار المؤسسات التي تتناسب مع أهداف الطلاب، ميزانيتهم، وملفهم الأكاديمي.";Text
;en;ar;"How do certificate programs in the USA accelerate your career?";"كيف تسرع برامج الشهادات في أمريكا مسيرتك المهنية؟";Text
;en;ar;"What makes the San Diego summer camp the ideal choice for teens?";"ما الذي يجعل المخيم الصيفي في San Diego الخيار الأمثل للمراهقين؟";Text
;en;ar;"Why do small classes at an english language school accelerate fluency?";"لماذا تسرع الفصول الصغيرة في مدرسة لغة إنجليزية من الطلاقة؟";Text
;en;ar;"How do specific courses match different student goals?";"كيف تتناسب الدورات المحددة مع أهداف الطلاب المختلفة؟";Text
;en;ar;"Business professionals also gain immense value from this individualized format. Instead of studying broad corporate terminology, you can bring your actual work presentations or emails into the classroom. The instructor helps you refine your communication style. This ensures you sound professional and persuasive in international meetings. Adult learners who need to master specific industry vocabulary often find that private lessons save them weeks of study time.";"يكتسب المحترفون في مجال الأعمال أيضاً قيمة هائلة من هذا النمط الفردي. بدلاً من دراسة مصطلحات الشركات الواسعة، يمكنك إحضار عروض عملك الفعلية أو رسائلك الإلكترونية إلى الفصل. يساعدك المعلم على تحسين أسلوب تواصلك. يضمن هذا أن تبدو محترفاً ومقنعاً في الاجتماعات الدولية. يجد المتعلمون البالغون الذين يحتاجون إلى إتقان مفردات صناعة معينة غالباً أن الدروس الخاصة توفر عليهم أسابيع من وقت الدراسة.";Text
;en;ar;"Real World Practice";"الممارسة في العالم الحقيقي";Text
;en;ar;"We organize homestay assignments across the metropolitan area. The cultural background of families in this city reflects its diverse population. You might live with a retired couple, a young family with small children, or a single professional. Each household offers a uniquely Canadian experience. Students participating in English for global careers often find that observing local professional habits provides unexpected networking insights. Taking courses to learn English in Canada means adopting local ways of living.";"نحن ننظم توزيع الإقامات مع العائلات في جميع أنحاء المنطقة الحضرية. تعكس الخلفية الثقافية للعائلات في هذه المدينة تنوع سكانها. قد تعيش مع زوجين متقاعدين، أو عائلة شابة لديها أطفال صغار، أو مهني أعزب. تقدم كل أسرة تجربة كندية فريدة من نوعها. الطلاب المشاركون في برنامج اللغة الإنجليزية للمهن العالمية غالباً ما يجدون أن مراقبة العادات المهنية المحلية توفر رؤى تواصل غير متوقعة. أخذ دورات لتعلم اللغة الإنجليزية في كندا يعني تبني طرق العيش المحلية.";Text
;en;ar;"What are the daily routines and transit options?";"ما هو الروتين اليومي وخيارات التنقل؟";Text
;en;ar;"Budgeting and self-catering confidence";"الميزانية والثقة في الخدمة الذاتية";Text
