id;language_from;language_to;word_from;word_to;type
;en;ar;"Vancouver independent living";"العيش المستقل في Vancouver";Text
;en;ar;"Mastering vocabulary and group dynamics";"إتقان المفردات وتفاعلات المجموعة";Text
;en;ar;"How does our language school in Los Angeles work?";"كيف تعمل مدرسة اللغة التابعة لنا في Los Angeles؟";Text
;en;ar;"Academic Pathway USA";"المسار الأكاديمي في الولايات المتحدة";Text
;en;ar;"Navigating the downtown neighborhood";"استكشاف حي وسط المدينة";Text
;en;ar;"Why choose our english language school in Vancouver?";"لماذا تختار مدرسة لغة إنجليزية تابعة لنا في Vancouver؟";Text
;en;ar;"Test strategies and classroom focus";"استراتيجيات الاختبار والتركيز داخل الفصل";Text
;en;ar;"Students who choose a homestay find that their speaking confidence improves fastest when they are forced to use the language at home. Finding the right words over dinner or asking for directions to the grocery store forces you to think in English. If you encounter difficulties, reading about ways to overcome difficulties learning English can help you manage common early frustrations. Your host family understands that you are a student. They will patiently encourage you to express yourself.";"يجد الطلاب الذين يختارون الإقامة مع عائلة أن ثقتهم في التحدث تتحسن بأسرع ما يمكن عندما يُضطرون لاستخدام اللغة في المنزل. البحث عن الكلمات المناسبة أثناء العشاء أو طلب الاتجاهات إلى متجر البقالة يجبرك على التفكير باللغة الإنجليزية. إذا واجهت صعوبات، فإن القراءة عن طرق التغلب على صعوبات تعلم اللغة الإنجليزية يمكن أن تساعدك في التعامل مع الإحباطات المبكرة الشائعة. تدرك عائلتك المضيفة أنك طالب. وسيشجعونك بصبر على التعبير عن نفسك.";Text
;en;ar;"Who benefits most from this arrangement?";"من المستفيد الأكبر من هذا الترتيب؟";Text
;en;ar;"Downtown Student Living";"سكن الطلاب في وسط المدينة";Text
;en;ar;"Living in the Fairview district offers a practical balance between quiet residential streets and access to major city amenities. Because the apartment economy apt living requires self-catering, you handle your own grocery shopping and daily cooking. This setup naturally encourages you to interact with neighbors and vendors. Every interaction outside your studio contributes to your learning progress. Students who enroll in General English classes often use their evenings to practice new vocabulary while running errands. You set your schedule. Total independence. The space itself holds exactly what a single student needs for a productive stay. Reviewing other housing options shows that self-catering studios provide the highest level of personal freedom. A 30-minute commute is standard for urban professionals, giving you a highly authentic experience. By the time you arrive at the school, your mind is fully engaged in the target language.";"يقدم العيش في حي فيرفيو توازناً عملياً بين الشوارع السكنية الهادئة وسهولة الوصول إلى مرافق المدينة الرئيسية. نظراً لأن السكن في الشقة الاقتصادية يتطلب الخدمة الذاتية، فإنك تتولى تسوق البقالة والطبخ اليومي بنفسك. يشجعك هذا النظام بطبيعة الحال على التفاعل مع الجيران والبائعين. تساهم كل محادثة خارج الاستوديو الخاص بك في تقدمك التعليمي. يستخدم الطلاب المسجلون في فصول إنجليزية عامة أمسياتهم عادةً لممارسة المفردات الجديدة أثناء قضاء حوائجهم. أنت من يحدد جدولك. استقلالية تامة. تحتوي المساحة نفسها على ما يحتاجه طالب واحد بالضبط لإقامة مثمرة. تظهر مراجعة خيارات السكن الأخرى أن استوديوهات الخدمة الذاتية توفر أعلى مستوى من الحرية الشخصية. تعد رحلة التنقل لمدة 30 دقيقة معياراً قياسياً للمهنيين في المدن، مما يمنحك تجربة أصلية للغاية. وبحلول وقت وصولك إلى مدرسة لغة، يكون عقلك منخرطاً تماماً في اللغة المستهدفة.";Text
;en;ar;"Choosing the right curriculum depends entirely on what you want to achieve. Many students start with a standard foundation at our english language school. Our general English courses build everyday vocabulary and practical grammar. If you plan to sit for formal exams, the focus shifts. A specialized Cambridge prep program targets the exact reading, writing, and speaking formats required for a passing score. The material is rigorous. The practice tests are timed. For those focusing on professional growth, career development modules introduce project-based learning. You simulate business meetings, analyze artificial intelligence trends, and practice project management vocabulary. This builds immediate career-ready skills. We also accommodate absolute beginners who need a private focus. Adding one-on-one sessions allows your instructor to isolate specific pronunciation habits or grammar gaps. Not sure which track fits best? Take a moment to explore all of our classes and compare the weekly schedules.";"يعتمد اختيار المنهج الصحيح كلياً على ما تريد تحقيقه. يبدأ العديد من الطلاب بأساس قياسي في مدرسة لغة إنجليزية تابعة لنا. تبني [دورات إنجليزية عامة] لدينا المفردات اليومية والقواعد العملية. يتحول التركيز إذا كنت تخطط للجلوس للامتحانات الرسمية. يستهدف [برنامج التحضير لشهادة كامبريدج] المتخصص تنسيقات القراءة، الكتابة، والتحدث الدقيقة المطلوبة للحصول على درجة النجاح. المادة العلمية صارمة. الاختبارات التدريبية محددة بوقت. تقدم وحدات التطوير المهني التعلم القائم على المشاريع لأولئك الذين يركزون على النمو المهني. تحاكي اجتماعات العمل، وتحلل اتجاهات الذكاء الاصطناعي، وتمارس مفردات إدارة المشاريع. يبني هذا مهارات جاهزة للعمل فوراً. نستقبل أيضاً المبتدئين تماماً الذين يحتاجون إلى تركيز خاص. تتيح إضافة جلسات فردية لمعلمك عزل عادات نطق معينة أو فجوات نحوية. لست متأكداً من المسار الأنسب؟ خذ لحظة لاستعراض [جميع فصولنا] ومقارنة الجداول الأسبوعية.";Text
;en;ar;"Who is the shared apartment downtown best suited for?";"لمن تناسب الشقة المشتركة في وسط المدينة؟";Text
;en;ar;"Finding the right balance of privacy and connection";"إيجاد التوازن الصحيح بين الخصوصية والتواصل";Text
;en;ar;"Students choosing between the english plus toefl preparation and our English Plus Cambridge Prep typically base their decision on geographic goals. The TOEFL iBT is widely requested by universities in North America. Cambridge English exams hold massive recognition across Europe and the United Kingdom. Both require intense dedication. If you plan to apply to undergraduate programs at American universities, the TOEFL iBT score provides the most direct route for admissions. Some candidates also consider focusing on English Academic Skills if they need more time to build fundamental university writing habits before tackling timed exam formats.";"يبني الطلاب الذين يختارون بين الإنجليزية بلس التحضير لاختبار التوفل ودورة التحضير لشهادة Cambridge English قرارهم عادةً بناءً على الأهداف الجغرافية. تطلب جامعات أمريكا الشمالية اختبار TOEFL iBT على نطاق واسع. تحظى امتحانات Cambridge English باعتراف هائل في جميع أنحاء أوروبا والمملكة المتحدة. كلاهما يتطلب تفانياً مكثفاً. إذا كنت تخطط للتقديم في برامج البكالوريوس في الجامعات الأمريكية، فإن درجة TOEFL iBT توفر الطريق الأكثر مباشرة للقبول. يفكر بعض المرشحين أيضاً في التركيز على مهارات اللغة الإنجليزية الأكاديمية إذا كانوا بحاجة إلى مزيد من الوقت لبناء عادات الكتابة الجامعية الأساسية قبل التعامل مع صيغ الاختبارات المحددة بوقت.";Text
;en;ar;"An eight-week duration acts as a solid foundation for noticeable fluency gains. Students arriving at an A2 or B1 level often experience a visible improvement in their daily communication skills within this timeframe. You develop stronger grammar control and improve your listening comprehension. By the end of two months, you might complete a full level advancement. The key is consistent attendance. Your progress depends directly on how intensely you practice reading and writing alongside spoken conversation. Exploring the city helps. Review our surprises of living in Vancouver as a student post to see how daily life reinforces classroom theory. Practicing your English in Vancouver neighborhoods like Kitsilano or Gastown forces you to use new phrasing naturally.";"تعمل مدة الثمانية أسابيع كأساس متين لتحقيق مكاسب ملحوظة في الطلاقة. يشهد الطلاب الذين يصلون بمستوى A2 أو B1 غالباً تحسناً واضحاً في مهارات التواصل اليومية ضمن هذا الإطار الزمني. تطور تحكماً أقوى في القواعد النحوية وتحسن فهمك المسموع. بحلول نهاية الشهرين، قد تكمل تقدماً بمستوى كامل. المفتاح هو الحضور المنتظم. يعتمد تقدمك مباشرة على مدى كثافة ممارستك للقراءة والكتابة جنباً إلى جنب مع المحادثة المنطوقة. التعرف على المدينة يساعدك. راجع مقالنا حول مفاجآت العيش في Vancouver كطالب لترى كيف تعزز الحياة اليومية النظرية الأكاديمية. تجبرك ممارسة لغتك الإنجليزية في أحياء Vancouver مثل Kitsilano أو Gastown على استخدام العبارات الجديدة بشكل طبيعي.";Text
;en;ar;"Pathway Career Training";"التدريب المهني في برنامج المسار";Text
;en;ar;"Equipment rentals are included in your afternoon sessions. You do not need to purchase a board or wetsuit before arriving in California. The coaching staff matches the equipment to your height, weight, and current skill level each week. As your balance improves, they transition you to shorter, more responsive boards. Your only daily responsibilities are attending your morning lessons, bringing adequate sun protection, and maintaining an open mindset.";"إيجارات المعدات مشمولة في جلساتك المسائية. لا تحتاج إلى شراء لوح أو بدلة غطس قبل وصولك إلى California. يطابق طاقم التدريب المعدات مع طولك ووزنك ومستوى مهارتك الحالي كل أسبوع. مع تحسن توازنك، ينقلونك إلى ألواح أقصر وأكثر استجابة. مسؤولياتك اليومية الوحيدة هي حضور دروسك الصباحية وإحضار حماية كافية من أشعة الشمس والحفاظ على عقلية منفتحة.";Text
;en;ar;"Graduates of U.S. degree programs can apply for Optional Practical Training (OPT), which allows up to 1 year of paid work in the United States after completing a degree (and longer for graduates of certain Science, Technology, Engineering, and Mathematics (STEM) fields). That career runway is one reason many students choose the U.S. route rather than studying entirely from abroad. Students who want to see the program location, meet the team, and plan a start date can reach CEL's San Diego language school directly.";"يمكن لخريجي برامج الدرجات الجامعية الأمريكية التقديم على التدريب العملي الاختياري (OPT)، والذي يسمح بما يصل إلى عام واحد من العمل مدفوع الأجر في الولايات المتحدة بعد إكمال الدرجة (ولفترة أطول لخريجي مجالات معينة في العلوم، والتكنولوجيا، والهندسة، والرياضيات (STEM)). تعتبر هذه الانطلاقة المهنية أحد الأسباب التي تدفع العديد من الطلاب لاختيار مسار الولايات المتحدة بدلاً من الدراسة بالكامل من الخارج. يمكن للطلاب الراغبين في رؤية موقع البرنامج، ومقابلة فريق العمل، وتحديد موعد للبدء التواصل مع مدرسة لغة تابعة لـ CEL في San Diego مباشرة.";Text
;en;ar;"Earning a high score on the Cambridge English: Advanced (CAE) requires dedicated strategy practice. Advanced learners usually spend 8 to 12 weeks purely on exam techniques. You must master the specific reading formats and strict time limits of the test. Taking practice exams under realistic conditions is essential. We provide personalized feedback on every mock test. If you are aiming for university admission, you might need a longer pathway. Many students spend 20 weeks or more bridging the gap between general fluency and academic readiness. You can review our undergraduate pathway programs to understand the required entry benchmarks for North American institutions.";"يتطلب الحصول على درجة عالية في شهادة Cambridge English: Advanced (CAE) ممارسة مخصصة للاستراتيجيات. يقضي المتعلمون المتقدمون عادة من 8 إلى 12 أسبوعاً للتركيز على تقنيات الاختبار. يجب عليك إتقان تنسيقات القراءة المحددة والحدود الزمنية الصارمة للاختبار. يعد إجراء الاختبارات التجريبية تحت ظروف واقعية أمراً ضرورياً. نقدم ملاحظات مخصصة لكل اختبار تجريبي. إذا كنت تهدف إلى القبول الجامعي، قد تحتاج إلى مسار أطول. يقضي العديد من الطلاب 20 أسبوعاً أو أكثر لسد الفجوة بين الطلاقة العامة والاستعداد الأكاديمي. يمكنك مراجعة برامج المسار الجامعي لمرحلة البكالوريوس لفهم معايير الدخول المطلوبة لمؤسسات أمريكا الشمالية.";Text
;en;ar;"Timeline expectations and level progression";"التوقعات الزمنية والتقدم في المستويات";Text
;en;ar;"Afternoons and weekends are built around an excursion programme rather than free time, with included visits across the Southern California coast and city. The published list includes Disneyland, Universal Studios, a Los Angeles day trip, a Major League Baseball game, San Diego Zoo, Belmont Park, Coronado Island, Balboa Park, Sea World, USS Midway Museum, Seaport Village, Old Town, Little Italy, and Fashion Valley, plus regular beach and park time given the Pacific Beach proximity. The mix is built so that students experience American teen-life routines (theme parks, ballparks, boardwalks) while practising English with peers from many different countries each summer. Parents and students who want answers to questions outside the camp brief can use the broader CEL FAQ covering courses, accreditation, and student support across all CEL programmes.";"تُبنى فترات ما بعد الظهر وعطلات نهاية الأسبوع حول برنامج رحلات بدلاً من وقت الفراغ، مع زيارات متضمنة عبر ساحل ومدن جنوب كاليفورنيا. تشمل القائمة المنشورة ديزني لاند، يونيفرسال ستوديوز، رحلة يومية إلى Los Angeles، مباراة بيسبول ضمن الدوري الرئيسي، حديقة حيوان San Diego، بيلمونت بارك، جزيرة كورونادو، حديقة بالبوا، سي وورلد، متحف يو إس إس ميدواي، قرية الميناء (Seaport Village)، المدينة القديمة (Old Town)، إيطاليا الصغيرة (Little Italy)، وفاشون فالي، إضافة إلى وقت منتظم في الشاطئ والمنتزه نظراً للقرب من باسيفيك بيتش. صُمم هذا المزيج ليتيح للطلاب تجربة روتين حياة المراهقين الأمريكيين (المتنزهات الترفيهية، ملاعب الكرة، الممرات الخشبية) أثناء ممارسة اللغة الإنجليزية مع أقرانهم من بلدان متعددة كل صيف. يمكن للآباء والطلاب الذين يبحثون عن إجابات لأسئلة خارج نطاق ملخص المخيم استخدام الأسئلة الشائعة لمعهد CEL والتي تغطي الدورات، الاعتماد، ودعم الطلاب في جميع برامج CEL.";Text
;en;ar;"Daily life and academic progression";"الحياة اليومية والتقدم الأكاديمي";Text
;en;ar;"Maintaining energy levels is the primary challenge for new arrivals. The water demands significant physical stamina. Your first week will feel exhausting. Students typically need about 7 days to adapt to the rhythm of intensive mental focus followed by active exertion. We structure the english plus surfing schedule specifically to support this physical balance. Morning classes run efficiently to ensure you maximize your peak cognitive hours.";"الحفاظ على مستويات الطاقة هو التحدي الأساسي للوافدين الجدد. تتطلب المياه قدرة بدنية كبيرة. سيبدو أسبوعك الأول مرهقاً. يحتاج الطلاب عادةً إلى حوالي 7 أيام للتكيف مع إيقاع التركيز العقلي المكثف الذي يتبعه مجهود نشط. نصمم جدول الإنجليزية وركوب الأمواج خصيصاً لدعم هذا التوازن البدني. تسير الفصول الصباحية بكفاءة لضمان تحقيق أقصى استفادة من ساعات الذروة المعرفية لديك.";Text
;en;ar;"What can you expect from the lifestyle and urban environment?";"ماذا تتوقع من نمط الحياة والبيئة الحضرية؟";Text
;en;ar;"Meeting the language level requirements";"استيفاء متطلبات مستوى اللغة";Text
;en;ar;"Because this housing option features shared bathrooms and communal living spaces, house rules exist to maintain harmony. Every resident must clean up their own messes immediately. If you cook, you wash your pots and pans before leaving the kitchen. Minimum age restrictions ensure a certain level of maturity among residents. Everyone must be at least 17 years old to book this accommodation. Noise curfews typically apply late at night to ensure everyone gets enough sleep. When issues arise, direct communication solves most problems. Living closely with others teaches valuable interpersonal skills that extend far beyond grammar and vocabulary.";"نظراً لأن خيار السكن هذا يتميز بحمامات ومساحات معيشة مشتركة، توجد قواعد للمنزل للحفاظ على الانسجام. يجب على كل مقيم تنظيف الفوضى التي يتسبب بها فوراً. إذا قمت بالطبخ، فاغسل الأواني والمقالي قبل مغادرة المطبخ. تضمن قيود الحد الأدنى للعمر مستوى معيناً من النضج بين المقيمين. يشترط أن يكون عمر الجميع 17 عاماً على الأقل لحجز هذا السكن. تُطبق قيود الضوضاء عادة في وقت متأخر من الليل لضمان حصول الجميع على قسط كافٍ من النوم. عند ظهور مشكلات، يحل التواصل المباشر معظم العقبات. يعلمك العيش عن قرب مع الآخرين مهارات شخصية قيمة تتجاوز القواعد والمفردات بكثير.";Text
;en;ar;"When choosing Vancouver vs Toronto, weather is often the first major consideration. Students who dislike freezing temperatures typically gravitate toward the west coast. The city experiences mild winters and moderate temperatures throughout the year. You can ski in the nearby mountains and walk along the ocean in the exact same week. Rain is common, especially in winter, but extreme cold is rare. Evaluating Vancouver vs Toronto weather profiles reveals a stark contrast. The eastern metropolis features four distinct seasons. You will experience cold, snowy winters and hot, humid summers. This clear seasonal contrast appeals to students who want a traditional winter experience alongside their language studies.";"عند الاختيار بين Vancouver وتورونتو، يمثل الطقس غالباً الاعتبار الرئيسي الأول. يميل الطلاب الذين لا يفضلون درجات الحرارة شديدة البرودة عادة إلى الساحل الغربي. تشهد المدينة فصول شتاء معتدلة ودرجات حرارة لطيفة على مدار العام. يمكنك التزلج في الجبال القريبة والمشي بمحاذاة المحيط في الأسبوع نفسه. يعد المطر شائعاً خاصة في فصل الشتاء، لكن البرودة الشديدة نادرة الحدوث. يكشف تقييم أنماط الطقس بين Vancouver وتورونتو عن اختلاف حاد. تتميز المدينة الشرقية الكبرى بأربعة فصول متمايزة. ستعيش شتاءً بارداً ومثلجاً وصيفاً حاراً ورطباً. يجذب هذا التباين الموسمي الواضح الطلاب الراغبين في عيش أجواء الشتاء التقليدية تزامناً مع دراستهم اللغوية.";Text
;en;ar;"Housing considerations for long-term study";"اعتبارات السكن للدراسة طويلة الأمد";Text
;en;ar;"Everyday language skills";"مهارات اللغة اليومية";Text
;en;ar;"Exam preparation";"التحضير للاختبارات";Text
;en;ar;"Accommodation and focus outside the classroom";"السكن والتركيز خارج الفصل الدراسي";Text
;en;ar;"What to expect in the classroom";"ماذا تتوقع داخل الفصل الدراسي";Text
;en;ar;"How to Learn English in the USA";"كيف تتعلم اللغة الإنجليزية في الولايات المتحدة";Text
;en;ar;"The pathway combines intensive academic English at CEL's San Diego campus with admissions support for the partner-college stage of the journey, taught in classes that average 7 students and reach a maximum of 12. CEL is accredited by the Commission on English Language Program Accreditation (CEA) and certified by the Student and Exchange Visitor Information System (SEVIS), which means the school can issue the Form I-20 international students need to apply for an F-1 Student Visa. Admissions advisors help students assemble the documentation each partner institution requires, including transcripts, English-proficiency evidence, and statements of intent, so the move into a college program is supported rather than improvised.";"يجمع المسار بين دراسة الإنجليزية الأكاديمية المكثفة في حرم CEL في San Diego ودعم القبول لمرحلة الكلية الشريكة في هذه الرحلة التعليمية، وتُقدم الدروس في فصول يبلغ متوسط عدد طلابها 7 وتصل كحد أقصى إلى 12 طالباً. معهد CEL معتمد من قبل لجنة اعتماد برامج اللغة الإنجليزية (CEA) وموثق من نظام معلومات الطلاب والزائرين لبرامج التبادل (SEVIS)، مما يتيح للمعهد إصدار نموذج I-20 الذي يتطلبه الطلاب الدوليون للتقديم على فيزا F-1 للطلاب. يقدم مستشارو القبول المساعدة للطلاب في تجهيز المستندات التي تتطلبها كل مؤسسة شريكة، مثل السجلات الأكاديمية، أدلة إتقان اللغة الإنجليزية، وخطابات النوايا، ليكون الانتقال إلى البرنامج الجامعي مبنياً على دعم حقيقي بدلاً من الارتجال.";Text
